Sheet: Sheet1
A1: 2t（1400kw）直接供热1台
A2: 序号 | B2: 名 称 | C2: 品牌 | D2: 型号 （规格） | E2: 参数 | F2: 数量 | G2: 单价 | H2: 间接价格
A3: 1 | B3: 铸铁热水锅炉 | C3: 山东前田 | D3: ZZS1.75-0.7/95/70-Y(Q)-MF7 | E3: 1400KW | F3: 1 | G3: 257500 | H3: =RC[-2]*RC[-1] -> 257500
A4: 2 | B4: 自动软水装置 | D4: =R[9]C[11] -> 0 | E4: 1.0m3/h | F4: 1 | G4: 1900 | H4: =RC[-2]*RC[-1] -> 1900
A5: 3 | B5: 软化水箱 | D5: =R[7]C[11] -> 0 | E5: 2立方米 | F5: 1 | G5: 7700 | H5: =RC[-2]*RC[-1] -> 7700
A6: 8 | B6: 循环泵 | C6: 上海凯泉 | D6: =R[4]C[8] -> 0 | E6: 流量55m3/h 扬程32m （一用一备） | F6: 2 | G6: 3300 | H6: =RC[-2]*RC[-1] -> 6600
A7: 4 | B7: 补水泵 | C7: 上海凯泉 | D7: =R[-2]C[8] -> 0 | E7: 流量1.5m3/h 扬程60m （一用一备） | F7: 2 | G7: 1600 | H7: =RC[-2]*RC[-1] -> 3200
A8: 5 | B8: 膨胀罐 | D8: φ500 | E8: 250L | F8: 1 | G8: 3500 | H8: =RC[-2]*RC[-1] -> 3500
E9: 设备费用（元） | H9: =SUM(R[-6]C:R[-1]C) -> 280400
B10: 附件安装费用 | D10: 占设备费用50% | E10: 总价（元） | H10: =R[-1]C*(1+0.5) -> 420600