Sheet: Sheet1
A1: 3t（2100kw）间接供热3台
A2: 序号 | B2: 名 称 | C2: 品牌 | D2: 型号 （规格） | E2: 参数 | F2: 数量 | G2: 单价 | H2: 间接价格
A3: 1 | B3: 铸铁热水锅炉 | C3: 山东前田 | D3: ZZS0.7-0.7/95/70-Y(Q)-MF5 | E3: 700KW 三台 | F3: 3 | G3: 185000 | H3: =RC[-2]*RC[-1] -> 555000
A4: 2 | B4: 自动软水装置 | D4: =R[9]C[11] -> 0 | E4: 1.5m3/h | F4: 1 | G4: 1900 | H4: =RC[-2]*RC[-1] -> 1900
A5: 3 | B5: 软化水箱 | D5: =R[7]C[11] -> 0 | E5: 2.5立方米 | F5: 1 | G5: 5000 | H5: =RC[-2]*RC[-1] -> 5000
A6: 4 | B6: 一次补水泵 | C6: 上海凯泉 | D6: =R[-1]C[10] -> 0 | E6: 流量0.2m3/h 扬程10m （一用一备） | F6: 2 | G6: 1600 | H6: =RC[-2]*RC[-1] -> 3200
A7: 5 | B7: 一次膨胀罐 | D7: φ200 | E7: 50L | F7: 1 | G7: 3500 | H7: =RC[-2]*RC[-1] -> 3500
A8: 6 | B8: 一次循环泵 | C8: 上海凯泉 | D8: =R[2]C[10] -> 0 | E8: 流量27m3/h 扬程15m （互备） | F8: 3 | G8: 2200 | H8: =RC[-2]*RC[-1] -> 6600
A9: 7 | B9: 板式换热器 | C9: 淄博泰勒 | D9: =R[5]C[8] -> 0 | E9: 换热面积25m2（互备） | F9: 3 | G9: 11500 | H9: =RC[-2]*RC[-1] -> 34500
A10: 8 | B10: 二次循环泵 | C10: 上海凯泉 | D10: =RC[8] -> 0 | E10: 流量27m3/h 扬程32m （互备） | F10: 3 | G10: 3600 | H10: =RC[-2]*RC[-1] -> 10800
A11: 4 | B11: 二次补水泵 | C11: 上海凯泉 | D11: =R[-6]C[8] -> 0 | E11: 流量2.0m3/h 扬程60m （一用一备） | F11: 2 | G11: 1600 | H11: =RC[-2]*RC[-1] -> 3200
A12: 5 | B12: 二次膨胀罐 | D12: φ600 | E12: 350L | F12: 1 | G12: 4000 | H12: =RC[-2]*RC[-1] -> 4000
E13: 设备费用（元） | H13: =SUM(R[-10]C:R[-1]C) -> 627700
B14: 附件及安装费用 | D14: 占设备费用50% | E14: 总价（元） | H14: =R[-1]C*(1+0.5) -> 941550