Sheet: Sheet1
A1: 3t（2100kw）直接供热3台
A2: 序号 | B2: 名 称 | C2: 品牌 | D2: 型号 （规格） | E2: 参数 | F2: 数量 | G2: 单价 | H2: 间接价格
A3: 1 | B3: 铸铁热水锅炉 | C3: 山东前田 | D3: ZZS0.7-0.7/95/70-Y(Q)-MF5 | E3: 700KW | F3: 3 | G3: 185000 | H3: =RC[-2]*RC[-1] -> 555000
A4: 2 | B4: 自动软水装置 | D4: =R[9]C[11] -> 0 | E4: 1.5m3/h | F4: 1 | G4: 1900 | H4: =RC[-2]*RC[-1] -> 1900
A5: 3 | B5: 软化水箱 | D5: =R[7]C[11] -> 0 | E5: 1立方米 | F5: 1 | G5: 5000 | H5: =RC[-2]*RC[-1] -> 5000
A6: 8 | B6: 循环泵 | C6: 上海凯泉 | D6: =R[4]C[8] -> 0 | E6: 流量27m3/h 扬程32m （互备） | F6: 3 | G6: 3600 | H6: =RC[-2]*RC[-1] -> 10800
A7: 4 | B7: 补水泵 | C7: 上海凯泉 | D7: =R[-2]C[8] -> 0 | E7: 流量1.0m3/h 扬程60m （一用一备） | F7: 2 | G7: 1600 | H7: =RC[-2]*RC[-1] -> 3200
A8: 5 | B8: 膨胀罐 | D8: φ600 | E8: 350L | F8: 1 | G8: 4000 | H8: =RC[-2]*RC[-1] -> 4000
E9: 设备费用（元） | H9: =SUM(R[-6]C:R[-1]C) -> 579900
B10: 附件及安装费用 | D10: 占设备费用50% | E10: 总价（元） | H10: =R[-1]C*(1+0.5) -> 869850